[
  {
    "id": "src-usgs-api",
    "name": "USGS Earthquake API (2.5+ M, 1 Day)",
    "url": "https://earthquake.usgs.gov/earthquakes/feed/v1.0/summary/2.5_day.geojson",
    "organizationId": "org-usgs",
    "license": "Public Domain"
  },
  {
    "id": "src-aftershocks-placeholder",
    "name": "Source for Aftershocks",
    "url": "https://example.com/placeholder",
    "organizationId": "org-usgs"
  },
  {
    "id": "src-osm-overpass",
    "name": "OpenStreetMap Overpass API",
    "url": "https://overpass-api.de",
    "organizationId": "org-osm"
  },
  {
    "id": "src-shelters-placeholder",
    "name": "Source for Shelters",
    "url": "https://example.com/placeholder",
    "organizationId": "org-ocha"
  },
  {
    "id": "src-collection-centers-chile-placeholder",
    "name": "Source for Collection Centers (Chile)",
    "url": "https://example.com/placeholder",
    "organizationId": "org-cruz-roja-ve"
  },
  {
    "id": "src-road-closures-placeholder",
    "name": "Source for Road Closures",
    "url": "https://example.com/placeholder",
    "organizationId": "org-proteccion-civil"
  },
  {
    "id": "src-damage-assessment-placeholder",
    "name": "Source for Damage Assessment",
    "url": "https://example.com/placeholder",
    "organizationId": "org-copernicus-ems"
  },
  {
    "id": "src-satellite-imagery-placeholder",
    "name": "Source for Satellite Imagery",
    "url": "https://example.com/placeholder",
    "organizationId": "org-copernicus-ems"
  },
  {
    "id": "src-landslides-placeholder",
    "name": "Source for Landslides",
    "url": "https://example.com/placeholder",
    "organizationId": "org-funvisis"
  },
  {
    "id": "src-power-outages-placeholder",
    "name": "Source for Power Outages",
    "url": "https://example.com/placeholder",
    "organizationId": "org-proteccion-civil"
  },
  {
    "id": "src-airports-placeholder",
    "name": "Source for Airports",
    "url": "https://example.com/placeholder",
    "organizationId": "org-gdacs"
  },
  {
    "id": "src-ports-placeholder",
    "name": "Source for Ports",
    "url": "https://example.com/placeholder",
    "organizationId": "org-gdacs"
  },
  {
    "id": "src-volunteer-organizations-placeholder",
    "name": "Source for Volunteer Organizations",
    "url": "https://example.com/placeholder",
    "organizationId": "org-hot-osm"
  },
  {
    "id": "src-donation-campaigns-placeholder",
    "name": "Source for Donation Campaigns",
    "url": "https://example.com/placeholder",
    "organizationId": "org-reliefweb"
  },
  {
    "id": "src-funvisis-maravilla",
    "name": "FUNVISIS Maravilla Feed",
    "url": "http://www.funvisis.gob.ve/maravilla.json",
    "organizationId": "org-funvisis"
  },
  {
    "id": "src-gem-gafdb",
    "name": "GEM Global Active Faults Database",
    "url": "https://github.com/GEMScienceTools/gem-global-active-faults",
    "organizationId": "org-gem",
    "license": "CC-BY-SA-4.0"
  },
  {
    "id": "src-usgs-ds-199",
    "name": "USGS Data Series 199 (Geologic Map of Northern Venezuela)",
    "url": "https://pubs.usgs.gov/ds/2006/199/",
    "organizationId": "org-usgs"
  },
  {
    "id": "src-vantor",
    "name": "Vantor Open Data Program",
    "url": "https://vantor-opendata.s3.amazonaws.com",
    "organizationId": "org-vantor"
  },
  {
    "id": "src-copernicus",
    "name": "Copernicus Emergency Management Service",
    "url": "https://emergency.copernicus.eu/",
    "organizationId": "org-copernicus-ems"
  },
  {
    "id": "src-nasa-arcgis",
    "name": "NASA EarthData",
    "url": "https://gis.earthdata.nasa.gov",
    "organizationId": "org-nasa",
    "type": "ArcGIS FeatureServer"
  },
  {
    "id": "src-citizen-reports",
    "name": "Citizen Crowdsourced Aggregation",
    "url": "https://venezuelatebusca.com/",
    "organizationId": "org-volunteer"
  }
]